src/ai/amazons_engine/engine/KataGoData/opencltuning/tune8_gpuIntelRUHDGraphics_x10_y10_c256_mv10.txt
VERSION=8
#shouldUseFP16Storage
1
#shouldUseFP16Compute
1
#shouldUseFP16TensorCores
0
#xGemmDirect
WGD=32 MDIMCD=8 NDIMCD=8 MDIMAD=8 NDIMBD=16 KWID=8 VWMD=4 VWND=2 PADA=1 PADB=1
#xGemm
MWG=64 NWG=64 KWG=32 MDIMC=8 NDIMC=16 MDIMA=8 NDIMB=16 KWI=2 VWM=4 VWN=4 STRM=0 STRN=0 SA=1 SB=1
#xGemm16
MWG=64 NWG=64 KWG=32 MDIMC=8 NDIMC=16 MDIMA=8 NDIMB=16 KWI=2 VWM=4 VWN=4 STRM=0 STRN=0 SA=1 SB=1
#hGemmWmma
MWG=16 NWG=16 KWG=16 MWAVE=16 NWAVE=16 MWARP=16 NWARP=16 VWM=2 VWN=2 SA=0 SB=0
#conv3x3
INTILE_XSIZE=6 INTILE_YSIZE=6 OUTTILE_XSIZE=4 OUTTILE_YSIZE=4 transLocalSize0=16 transLocalSize1=16 untransLocalSize0=8 untransLocalSize1=2 untransLocalSize2=4
#conv5x5
INTILE_XSIZE=6 INTILE_YSIZE=6 OUTTILE_XSIZE=2 OUTTILE_YSIZE=2 transLocalSize0=16 transLocalSize1=16 untransLocalSize0=8 untransLocalSize1=2 untransLocalSize2=4
#gPool
XYSTRIDE=16 CHANNELSTRIDE=1 BATCHSTRIDE=4
